{
  "campaign": "v3-bosch-interior-descriptive-review",
  "completeness": {
    "all_metrics_finite": true,
    "expected_cases": 18,
    "level_counts": {
      "deposition_thickness": {
        "high": 9,
        "low": 9
      },
      "etch_time": {
        "high": 9,
        "low": 9
      },
      "ion_rate": {
        "high": 9,
        "low": 9
      },
      "ion_source_exponent": {
        "high": 8,
        "low": 10
      },
      "neutral_rate": {
        "high": 10,
        "low": 8
      },
      "neutral_sticking_probability": {
        "high": 10,
        "low": 8
      }
    },
    "observed_cases": 18,
    "rays_per_point": 500,
    "unique_case_ids": 18
  },
  "design": {
    "coded_high": 0.5,
    "coded_low": -0.5,
    "control_levels": {
      "deposition_thickness": {
        "high": 0.01414214,
        "low": 0.00387298
      },
      "etch_time": {
        "high": 1.0,
        "low": 0.31622777
      },
      "ion_rate": {
        "high": -0.06324555,
        "low": -0.14832397
      },
      "ion_source_exponent": {
        "high": 632,
        "low": 141
      },
      "neutral_rate": {
        "high": -0.04898979,
        "low": -0.12649111
      },
      "neutral_sticking_probability": {
        "high": 0.15491933,
        "low": 0.04
      }
    },
    "estimator": "ordinary least squares with intercept and six coded main effects; adjusted_high_minus_low is the fitted +0.5 minus -0.5 contrast",
    "factor_order": [
      "etch_time",
      "deposition_thickness",
      "ion_source_exponent",
      "ion_rate",
      "neutral_rate",
      "neutral_sticking_probability"
    ],
    "method": "18-case D-optimal interior refinement"
  },
  "effects": {
    "bow": {
      "observed_maximum": 0.04553441363171995,
      "observed_minimum": 0.0038737406527687146,
      "ranked_factors": [
        {
          "absolute_effect_rank": 1,
          "adjusted_high_minus_low": 0.016795866482211548,
          "factor": "etch_time",
          "leave_one_out_maximum": 0.019045763747520227,
          "leave_one_out_minimum": 0.015620745110012432,
          "leave_one_out_sign_stable": true
        },
        {
          "absolute_effect_rank": 2,
          "adjusted_high_minus_low": -0.01061010692259479,
          "factor": "neutral_rate",
          "leave_one_out_maximum": -0.009288170574253723,
          "leave_one_out_minimum": -0.012054741180943766,
          "leave_one_out_sign_stable": true
        },
        {
          "absolute_effect_rank": 3,
          "adjusted_high_minus_low": -0.007955608686221041,
          "factor": "ion_rate",
          "leave_one_out_maximum": -0.006976340876055128,
          "leave_one_out_minimum": -0.009830523073978284,
          "leave_one_out_sign_stable": true
        },
        {
          "absolute_effect_rank": 4,
          "adjusted_high_minus_low": -0.006277297016285333,
          "factor": "deposition_thickness",
          "leave_one_out_maximum": -0.004926470177309664,
          "leave_one_out_minimum": -0.008152211404042545,
          "leave_one_out_sign_stable": true
        },
        {
          "absolute_effect_rank": 5,
          "adjusted_high_minus_low": -0.006105587477885573,
          "factor": "neutral_sticking_probability",
          "leave_one_out_maximum": -0.005073705864779171,
          "leave_one_out_minimum": -0.007480524695574214,
          "leave_one_out_sign_stable": true
        },
        {
          "absolute_effect_rank": 6,
          "adjusted_high_minus_low": -0.0032271085923746804,
          "factor": "ion_source_exponent",
          "leave_one_out_maximum": -0.0018521713746860462,
          "leave_one_out_minimum": -0.004258990205481072,
          "leave_one_out_sign_stable": true
        }
      ]
    },
    "cd_bottom": {
      "observed_maximum": 0.4022338477323447,
      "observed_minimum": 0.04237633729213138,
      "ranked_factors": [
        {
          "absolute_effect_rank": 1,
          "adjusted_high_minus_low": -0.1405783252591525,
          "factor": "deposition_thickness",
          "leave_one_out_maximum": -0.1315183921964961,
          "leave_one_out_minimum": -0.15088426414098205,
          "leave_one_out_sign_stable": true
        },
        {
          "absolute_effect_rank": 2,
          "adjusted_high_minus_low": 0.10270436276757224,
          "factor": "etch_time",
          "leave_one_out_maximum": 0.11227140403045648,
          "leave_one_out_minimum": 0.09183244309238464,
          "leave_one_out_sign_stable": true
        },
        {
          "absolute_effect_rank": 3,
          "adjusted_high_minus_low": -0.06564511512564565,
          "factor": "neutral_rate",
          "leave_one_out_maximum": -0.0514744491631301,
          "leave_one_out_minimum": -0.07295327164590476,
          "leave_one_out_sign_stable": true
        },
        {
          "absolute_effect_rank": 4,
          "adjusted_high_minus_low": -0.05236255152671354,
          "factor": "neutral_sticking_probability",
          "leave_one_out_maximum": -0.038191885564197836,
          "leave_one_out_minimum": -0.059670708046972554,
          "leave_one_out_sign_stable": true
        },
        {
          "absolute_effect_rank": 5,
          "adjusted_high_minus_low": -0.02948439940062078,
          "factor": "ion_source_exponent",
          "leave_one_out_maximum": -0.015313733438105142,
          "leave_one_out_minimum": -0.03832293300604546,
          "leave_one_out_sign_stable": true
        },
        {
          "absolute_effect_rank": 6,
          "adjusted_high_minus_low": -0.017432242168590423,
          "factor": "ion_rate",
          "leave_one_out_maximum": -0.008372309105934162,
          "leave_one_out_minimum": -0.02773818105041984,
          "leave_one_out_sign_stable": true
        }
      ]
    },
    "cd_middle": {
      "observed_maximum": 0.46825940464238525,
      "observed_minimum": 0.14351687338800106,
      "ranked_factors": [
        {
          "absolute_effect_rank": 1,
          "adjusted_high_minus_low": -0.11591734584985801,
          "factor": "deposition_thickness",
          "leave_one_out_maximum": -0.10982885325578037,
          "leave_one_out_minimum": -0.12093589961092235,
          "leave_one_out_sign_stable": true
        },
        {
          "absolute_effect_rank": 2,
          "adjusted_high_minus_low": 0.10951950076416045,
          "factor": "etch_time",
          "leave_one_out_maximum": 0.11315753836345255,
          "leave_one_out_minimum": 0.1044457569357626,
          "leave_one_out_sign_stable": true
        },
        {
          "absolute_effect_rank": 3,
          "adjusted_high_minus_low": -0.06252339218151651,
          "factor": "neutral_rate",
          "leave_one_out_maximum": -0.05562288076005293,
          "leave_one_out_minimum": -0.06903469676129391,
          "leave_one_out_sign_stable": true
        },
        {
          "absolute_effect_rank": 4,
          "adjusted_high_minus_low": -0.038507060565639704,
          "factor": "neutral_sticking_probability",
          "leave_one_out_maximum": -0.031606549144175954,
          "leave_one_out_minimum": -0.04250890192486168,
          "leave_one_out_sign_stable": true
        },
        {
          "absolute_effect_rank": 5,
          "adjusted_high_minus_low": -0.03190186513579535,
          "factor": "ion_rate",
          "leave_one_out_maximum": -0.02826382753650303,
          "leave_one_out_minimum": -0.03697560896419299,
          "leave_one_out_sign_stable": true
        },
        {
          "absolute_effect_rank": 6,
          "adjusted_high_minus_low": -0.0274903361357245,
          "factor": "ion_source_exponent",
          "leave_one_out_maximum": -0.020589824714260876,
          "leave_one_out_minimum": -0.03214126797842247,
          "leave_one_out_sign_stable": true
        }
      ]
    },
    "cd_top": {
      "observed_maximum": 0.4727499680868395,
      "observed_minimum": 0.26676106595459836,
      "ranked_factors": [
        {
          "absolute_effect_rank": 1,
          "adjusted_high_minus_low": 0.06388393490806071,
          "factor": "etch_time",
          "leave_one_out_maximum": 0.0702635330505755,
          "leave_one_out_minimum": 0.05405447476165693,
          "leave_one_out_sign_stable": true
        },
        {
          "absolute_effect_rank": 2,
          "adjusted_high_minus_low": -0.057119124675527586,
          "factor": "neutral_rate",
          "leave_one_out_maximum": -0.04961050928591374,
          "leave_one_out_minimum": -0.06437766815901601,
          "leave_one_out_sign_stable": true
        },
        {
          "absolute_effect_rank": 3,
          "adjusted_high_minus_low": -0.03308499515157073,
          "factor": "deposition_thickness",
          "leave_one_out_maximum": -0.024893778362901027,
          "leave_one_out_minimum": -0.0407405129225892,
          "leave_one_out_sign_stable": true
        },
        {
          "absolute_effect_rank": 4,
          "adjusted_high_minus_low": -0.02113442620478374,
          "factor": "neutral_sticking_probability",
          "leave_one_out_maximum": -0.01362581081516982,
          "leave_one_out_minimum": -0.02839296968827203,
          "leave_one_out_sign_stable": true
        },
        {
          "absolute_effect_rank": 5,
          "adjusted_high_minus_low": -0.018066894066957336,
          "factor": "ion_rate",
          "leave_one_out_maximum": -0.009875677278287625,
          "leave_one_out_minimum": -0.023345834782221547,
          "leave_one_out_sign_stable": true
        },
        {
          "absolute_effect_rank": 6,
          "adjusted_high_minus_low": -0.003562264499637498,
          "factor": "ion_source_exponent",
          "leave_one_out_maximum": 0.0034552934571292332,
          "leave_one_out_minimum": -0.011070879889251354,
          "leave_one_out_sign_stable": false
        }
      ]
    },
    "depth": {
      "observed_maximum": 1.2756522826297005,
      "observed_minimum": 0.6300620717363846,